Topic Id,Top Words...
0,trees prof tree scale 창 orange insects leaves solution disease rolfs work sulphur young state destroy red generally pounds blight
1,grapes grape prices good south vines ground car state chicago wright crate market roots vineyard received cents york feet vine
2,창 mr fruit good years year florida time trees put made make 1 growing place land found orange state ago
3,texas society tropical fruits horticultural state gulf region coast plants committee country states horticulture association meeting introduction varieties great california
4,창 potash ammonia acid 3 plant lime fertilizer grade cent sulphate cd phosphoric soil soda nitrate form results food salt
5,varieties oranges blood st citron citrus sweet fruits berry strawberry qualities lime cross malta crosses seeds moisture 1 limonia mandarin
6,fly rosin white wash spray webber prof soda scale effective 창 caustic water found gallons eggs insects pest juice cent
7,disease scale florida california horticultural state insect pest moth gypsy fluted olive jose importation vine society imported san source brought
8,manure stable grass fertilizer fertilizers potash seed ground good potatoes phosphate bermuda plant soil man vegetables straw oranges grow grove
9,fruit trees varieties blight peach pears market box boxes orchard pear limbs chicago barrels tree le harvey persimmon peaches shipped
